{
  "v": 1,
  "computer": "JOAQUIN-PC",
  "sentAt": "2026-10-17T09:12:00Z",
  "hooked": ["claude"],
  "tools": {
    "claude": {
      "readAt": "2026-10-17T09:11:42Z",
      "windows": [
        { "id": "five_hour", "usedPercent": 94, "resetsAt": "2020-01-01T05:00:00Z" },
        { "id": "seven_day", "usedPercent": 61.5, "resetsAt": "2026-10-21T00:00:00Z" }
      ]
    }
  }
}
