{
  "v": 1,
  "computer": "JOAQUIN-PC",
  "sentAt": "2026-10-17T09:12:00Z",
  "hooked": ["claude", "kiro"],
  "tools": {
    "claude": {
      "readAt": "2026-10-17T09:11:42Z",
      "windows": [
        { "id": "five_hour", "usedPercent": 38, "resetsAt": "2026-10-17T12:00:00Z" },
        { "id": "seven_day", "usedPercent": 61.5, "resetsAt": "2026-10-21T00:00:00Z" },
        { "id": "opus_weekly", "usedPercent": 12, "resetsAt": "2026-10-21T00:00:00Z", "label": "Opus weekly" }
      ]
    },
    "kiro": {
      "readAt": "2026-10-17T09:11:55Z",
      "plan": "pro",
      "windows": [
        { "id": "monthly", "usedPercent": 30, "resetsAt": "2026-11-01T00:00:00Z" }
      ]
    }
  }
}
